{"overall_status":"Current","generated_at":"2026-07-23T13:00:00Z","app_version":"0.1.0","build_commit":"fixture","fixture_mode":true,"freshness":{"cisa_kev_warn_hours":36,"cisa_kev_max_hours":96,"nvd_warn_hours":36,"nvd_max_hours":96,"epss_warn_hours":36,"epss_max_hours":96},"sources":[{"source":"cisa_kev","ok":true,"record_count":4,"fetched_at":"2026-07-23T13:00:00Z","used_last_known_good":false,"message":"fixture"},{"source":"nvd","ok":true,"record_count":11,"fetched_at":"2026-07-23T13:00:00Z","used_last_known_good":false,"message":"fixture"},{"source":"epss","ok":true,"record_count":11,"fetched_at":"2026-07-23T13:00:00Z","used_last_known_good":false,"message":"fixture"}]}